"id","category","city","country","cover","currency","date_online","description","external_id","is_online","lat","lng","location","price","price_unit","quantity","quantity_selector","supplier_email","title","url","_Conditionnement","_Région","_Brasserie","_Couleur de la bière","_Alcool %","_Amertume","_Gamme","_Contenant","_Volume","_Bière #1 du Pack","_Bière #2 du Pack","_L'avis d'Adopte Un Brasseur","_Bière #3 du Pack","_Bière #4 du Pack","_Bière #5 du Pack","_Bière #6 du Pack","_Caractéristiques","_Note Guide Hachette 2021","_Durée de l'abonnement","_Date de livraison"
"88076","Pilsner","Labarde","FR","https://cdn.kreezalid.com/kreezalid/550911/catalog/8080/108/28_c9xl2_1039393815.png","EUR","2020-11-18 16:17:36","La gamme des bières des brasseurs de Margaux, permet de découvrir facilement la bière. Chaque bière est numérotée de 1 à 6 afin de vous inciter à parcourir un chemin initiatique de découverte de l’amertume.
Alex, la numéro 2, est une bière blonde « lager » (c'est-à-dire de fermentation basse).
Nous l’avons créée afin de prouver qu’une bière bien faite peut être à la fois subtile et complexe. Le monde d’aujourd’hui est pressé si bien qu’on utilise souvent la chimie afin de raccourcir les délais de fabrication.
Nous avons fait le choix de laisser le temps faire son œuvre et d’intervenir le moins possible (comme dans la tradition brassicole allemande). Nous obtenons une bière subtile aux saveurs de miel et de pamplemousse. C’est une bière de soif avec un degré d’alcool de 5% également.
Alex se boit seule et à l'apéritif mais est idéale également avec de la cuisine épicée ou du poulet.","","1","45.02329","-0.638801","1 Route des Châteaux, 33460 Labarde, France","24","6","10","","emilie.pons@lesbrasseursdemargaux.fr","Alex 6x33cl","https://www.adopteunbrasseur.fr/listing/paph2drwrve-brasseurs-margaux-alex-blonde-6x33cl","Carton de 6","Nouvelle-Aquitaine","Brasseurs de Margaux","Blonde","5","Modérée","Permanente","Bouteille en verre","33cl","","","","","","","","Bio","","",""
"88038","Amber Ale","Labarde","FR","https://cdn.kreezalid.com/kreezalid/550911/catalog/8080/108/36_umiuu_387771576.png","EUR","2020-11-18 16:18:00","La gamme des bières des brasseurs de Margaux, permet de découvrir facilement la bière. Chaque bière est numérotée de 1 à 6 afin de vous inciter à parcourir un chemin initiatique de découverte de l’amertume.
Félix, la numéro 3, est une bière ambrée que nous avons développée afin de faire découvrir un goût différent : celui d’une bière certes houblonnée mais cependant peu amère. Elle est dans le style des bières belges mais avec un degré d’alcool très raisonnable à 6%. Le sucre donne en bouche une sensation de rondeur agréable, mais le houblon lui confère également une complexité aromatique séduisante.
Félix s'accorde pleinement avec les asperges, le jambon, le chou rouge ou la charcuterie fumée.","","1","45.02329","-0.638801","1 Route des Châteaux, 33460 Labarde, France","24","6","0","","emilie.pons@lesbrasseursdemargaux.fr","Félix 6x33cl","https://www.adopteunbrasseur.fr/listing/ncut9l4a9oy-brasseurs-margaux-felix-ambree-6x33cl","Carton de 6","Nouvelle-Aquitaine","Brasseurs de Margaux","Rousse","6","Modérée","Permanente","Bouteille en verre","33cl","","","","","","","","Bio","","",""
"88018","India Pale Ale","Labarde","FR","https://cdn.kreezalid.com/kreezalid/550911/catalog/8080/108/34_nm3ph_540266930.png","EUR","2020-11-18 16:18:32","La gamme des bières des brasseurs de Margaux, permet de découvrir facilement la bière. Chaque bière est numérotée de 1 à 6 afin de vous inciter à parcourir un chemin initiatique de découverte de l’amertume.
James, la numéro 6, a été conçue pour ceux qui aiment l’amertume : c’est une IPA avec un twist.
Son degré d’alcool est seulement de 4.5%. Sa couleur ressemble a celle des vins liquoreux et pourtant son amertume ne laisse aucun doute : c’est une bière pour les amateurs d’amertume.
Notre maitre Brasseur l'a créée pour remercier ses amis et son mari anglais d’avoir été si patients avec elle lorsqu’elle découvrait les bières avec eux.","","1","45.02329","-0.638801","1 Route des Châteaux, 33460 Labarde, France","24","6","10","","emilie.pons@lesbrasseursdemargaux.fr","James 6x33cl","https://www.adopteunbrasseur.fr/listing/2nu1vnshhxo-brasseurs-margaux-james-ipa-6x33cl","Carton de 6","Nouvelle-Aquitaine","Brasseurs de Margaux","Rousse","4.5","Modérée","Permanente","Bouteille en verre","33cl","","","","","","","","Bio","**","",""
"88017","Sweet Stout","Labarde","FR","https://cdn.kreezalid.com/kreezalid/550911/catalog/8080/108/38_fxz77_864406112.png","EUR","2020-11-18 16:18:54","La gamme des bières des brasseurs de Margaux, permet de découvrir facilement la bière. Chaque bière est numérotée de 1 à 6 afin de vous inciter à parcourir un chemin initiatique de découverte de l’amertume.
Manon, la numéro 4, est une brune peu alcoolisée avec 4.5% d’alcool.
Elle exprime pourtant son caractère à travers ses arômes de café, de cuir et de chocolat. Elle est légèrement fumée et sa légèreté surprend.
Sa longue tenue en bouche la rend facile à déguster. On l’apprécie cependant pour son étonnante légèreté.
Manon se déguste idéalement avec de la viande rouge, des champignons ou du chocolat.","","1","45.02329","-0.638801","1 Route des Châteaux, 33460 Labarde, France","24","6","10","","emilie.pons@lesbrasseursdemargaux.fr","Manon 6x33cl","https://www.adopteunbrasseur.fr/listing/oivkqh0nxsl-brasseurs-margaux-manon-porter-6x33cl","Carton de 6","Nouvelle-Aquitaine","Brasseurs de Margaux","Brune","4.5","Modérée","Permanente","Bouteille en verre","33cl","","","","","","","","Bio","***","",""
"88016","American Pale Ale","Labarde","FR","https://cdn.kreezalid.com/kreezalid/550911/catalog/8080/108/30_fdshs_1587768483.png","EUR","2020-11-18 15:27:33","La gamme des bières des brasseurs de Margaux, permet de découvrir facilement la bière. Chaque bière est numérotée de 1 à 6 afin de vous inciter à parcourir un chemin initiatique de découverte de l’amertume.
Emilie, la numéro 5, est la bière que notre maître brasseur a créée pour elle. Avec son houblon préféré, elle a souhaité produire une « American pale ale ».
Le résultat est une bière blonde un peu plus amère que les précédentes mais toujours avec seulement 5% d’alcool.
On peut ainsi en profiter jusqu’au bout de la nuit (avec modération bien sûr). Idéale seul ou avec un plat de poissons, sushis ou poulet","","1","45.02329","-0.638801","1 Route des Châteaux, 33460 Labarde, France","24","6","10","","emilie.pons@lesbrasseursdemargaux.fr","Emilie 6x33cl","https://www.adopteunbrasseur.fr/listing/tbz5w1vn7a-brasseurs-margaux-emilie-pale-ale-6x33cl","Carton de 6","Nouvelle-Aquitaine","Brasseurs de Margaux","Blonde","5","Modérée","Permanente","Bouteille en verre","33cl","","","","","","","","Bio","***","",""
"87761","Sweet Stout","Passy","FR","https://cdn.kreezalid.com/kreezalid/550911/catalog/8080/99/37_iblyh_1105428049.png","EUR","2020-11-17 20:08:30","Un mélange d’arômes café et chocolat, une stout gourmande ou l’on à ajouter du lactose et de l’avoine pour amener de l’épaisseur et de la douceur.","","0","45.919754","6.723183","50 Rue des Egratz, 74190 Passy, France","20.4","6","15","","tiff@bigmtnbrew.co","Breakfast Stout 6x33cl","https://www.adopteunbrasseur.fr/listing/ty4uydsdfpd-big-mountain-brewing-company-breakfast-stout-brune-6x33cl","Carton de 6","Auvergne Rhône-Alpes","","Brune","6.2","Modérée","Permanente","Bouteille en verre","33cl","","","","","","","","","","",""
"87611","Hazy / New England IPA (NEIPA)","Passy","FR","https://cdn.kreezalid.com/kreezalid/550911/catalog/8080/99/35_8y4kc_195208307.png","EUR","2020-11-17 11:44:20","Notre IPA d’Angleterre Nouvelle a des arômes d’agrumes, pêche, fraise, pamplemousse, melon, une touche de pin et faible en amertume.

 Blonde opaque
 Peche, fraise et agrumes
 Delicate, fruitee et cremeuse, faible en amertume
 Citra, Vic Secret, Idaho 7","","0","45.919754","6.723183","50 Rue des Egratz, 74190 Passy, France","22.2","6","15","","tiff@bigmtnbrew.co","NEIPA 6x33cl","https://www.adopteunbrasseur.fr/listing/4eqyox0wa84-brasseurs-big-mountain-brewing-company-neipa-blonde-6x33cl","Carton de 6","Auvergne Rhône-Alpes","","Blonde","5.3","Forte","Permanente","Bouteille en verre","33cl","","","","","","","","","","",""
"87609","Rye IPA","Passy","FR","https://cdn.kreezalid.com/kreezalid/550911/catalog/8080/99/33_6bf9g_1967651083.png","EUR","2020-11-17 11:44:34","Rye IPA – Une IPA différente. Le Malt de seigle donne une saveur douce et épicée au houblon du Pacific Nord-Est.

 Ambree
 Pin, écorce d’orange
 Epicée et amère
 Simcoe, Centennial, Chinook","","0","45.919754","6.723183","50 Rue des Egratz, 74190 Passy, France","21.4","6","15","","tiff@bigmtnbrew.co","Rye IPA 6x33cl","https://www.adopteunbrasseur.fr/listing/5xyxbdlsno9-big-mountain-brewing-company-rye-ipa-6x33cl","Carton de 6","Auvergne Rhône-Alpes","","Rousse","5.3","Modérée","Permanente","Bouteille en verre","33cl","","","","","","","","","","",""
"87598","Session IPA","Passy","FR","https://cdn.kreezalid.com/kreezalid/550911/catalog/8080/99/31_c761z_1639993072.png","EUR","2020-11-17 11:19:27","Session IPA – Vive et déborde d’arômes d’agrumes. Beaucoup de saveur, peu d’alcool.

 Blonde opaque
 Orange, pamplemousse et houblon
 Légère avec des arômes d’agrumes
 Simcoe, Amarillo, Centennial","","0","45.919754","6.723183","50 Rue des Egratz, 74190 Passy, France","21.4","6","15","","tiff@bigmtnbrew.co","Session IPA 6x33cl","https://www.adopteunbrasseur.fr/listing/e9oinkus162-big-mountain-brewing-company-session-ipa-blonde-6x33cl","Carton de 6","Auvergne Rhône-Alpes","","Blonde","3.8","Modérée","Permanente","Bouteille en verre","33cl","","","","","","","","","","",""
"87592","American Pale Ale","Passy","FR","https://cdn.kreezalid.com/kreezalid/550911/catalog/8080/99/29_y9ozy_1930760703.png","EUR","2020-11-17 11:19:56","Bien équilibrée, légère et se boit facilement. Cette pale ale est un bond en avant avec un soupçon de citron et pin.

 Blonde opaque
 Malte (legerement fruite, citron)
 Bière de soif aux arômes de citron et aiguilles de pin
 Centennial, Chinook","","0","45.919754","6.723183","50 Rue des Egratz, 74190 Passy, France","19.8","6","15","","tiff@bigmtnbrew.co","Pale Ale 6x33cl","https://www.adopteunbrasseur.fr/listing/loa2us9fogq-big-mountain-brewing-company-pale-ale-blonde-6x33cl","Carton de 6","Auvergne Rhône-Alpes","","Blonde","4.6","Modérée","Permanente","Bouteille en verre","33cl","","","","","","","","","","",""
"87590","India Pale Ale","Passy","FR","https://cdn.kreezalid.com/kreezalid/550911/catalog/8080/99/22_1zgf7_331537446.png","EUR","2020-11-17 11:19:43","Notre bière signature: l'IPA. Robe blonde opaque, avec au nez du fruit et des tropiques! Brassées avec nos houblons préférés, Simcoe et Centennial, qui donne des notes de pamplemousse et de fruit de la passion.","","0","45.919754","6.723183","50 Rue des Egratz, 74190 Passy, France","20.4","6","15","","tiff@bigmtnbrew.co","IPA 6x33cl","https://www.adopteunbrasseur.fr/listing/42xz9jylay0-big-mountain-brewing-company-ipa-blonde-6x33cl","Carton de 6","Auvergne Rhône-Alpes","","Blonde","5.2","Modérée","Permanente","Bouteille en verre","33cl","","","","","","","","","","",""
"87391","Tropical Stout","Paris","FR","https://cdn.kreezalid.com/kreezalid/550911/catalog/8080/99/67_dqir5_1489883691.png","EUR","2020-11-16 20:41:24","La BlackSky est une tropical Stout. Avec ses arômes torréfiés et fruités, cette bière naturellement Dark va t’exploser les papilles! HaStout’a la vista baby !
Arrivage le 10/12/2020","","1","48.848998","2.319394","19 Rue Pierre Leroux, 75007 Paris, France","24","6","0","","contact@1989brewing.com","BlackSky 6x33cl","https://www.adopteunbrasseur.fr/listing/4m7e9rq9d7e-1989-brewing-blacksky-noire-6x33cl","Carton de 6","Ile-de-France","1989 Brewing","Noire","7","Modérée","Nouveauté","Canette","33cl","","","","","","","","","","",""
"87386","Blonde Ale","Passy","FR","https://cdn.kreezalid.com/kreezalid/550911/catalog/8080/99/17_wii95_902858667.png","EUR","2020-11-16 20:25:27","Une bière blonde classique et douce à fermentation haute. Légèrement houblonné avec Cascade pour une style moderne et super facile à déguster.

 Blonde opaque
 Malte (legerement fruite)
 Bière de soif
 Cascade, Centennial","","0","45.919754","6.723183","50 Rue des Egratz, 74190 Passy, France","20","6","15","","tiff@bigmtnbrew.co","Blonde 6x33cl","https://www.adopteunbrasseur.fr/listing/8fhe93iw25-big-mountain-brewing-blonde-blonde-6x33cl","Carton de 6","Auvergne Rhône-Alpes","","Blonde","4","Faible","Permanente","Bouteille en verre","33cl","","","","","","","","","","",""
"86047","Hefeweizen","Forbach","FR","https://cdn.kreezalid.com/kreezalid/550911/catalog/8080/99/27_7soin_1477149029.png","EUR","2020-11-12 13:46:36","Bière Blanche de style Hefeweizen
- Malts : Pils , Blé, Munich, Caramel Malts
- Houblons : Saphir
- Levures : Weihenstephan 3068
C’est une bière de style ""Hefeweizen"", brassée dans la plus pure tradition bavaroise. D'une couleur orange opaque, que ce soit au nez ou en bouche, ce sont les arômes de banane mûre et de clou de girofle qui mènent la danse. La Weizenbier ou Weißbier est une bière essentiellement brassée en Bavière. Elle est nommée ainsi en raison de la couleur en surface après fermentation. Elle se distingue par un goût peu amer et une forte teneur en gaz.	","","1","49.206351","6.900877","4 Rue Jules Verne, 57600 Forbach, France","22.2","6","10","","alexandre.wirig@brasserie-galibot.com","Blanche 6x33cl","https://www.adopteunbrasseur.fr/listing/sehsfn73sj5-brasserie-galibot-blanche-blanche-6x33cl","Carton de 6","Grand Est","Galibot","Blanche","5.3","Faible","Permanente","Bouteille en verre","33cl","","","Cette blanche déroute d'abord visuellement: sa robe est proche d'une blonde et plutôt opaque, ce qui titille notre rétine et invite notre nez à s'en rapprocher. Vous avez dit banane mûre? Et bien oui, on vous le confirme (d'avis d'un mangeur de banane quotidien depuis plus de 25 ans). En bouche, c'est léger, rond, frais...Bref, c'est bon, tout simplement.","","","","","","","",""
"85992","Dark Lagers - Vienna","Forbach","FR","https://cdn.kreezalid.com/kreezalid/550911/catalog/8080/99/33_lvko2_1852430278.png","EUR","2020-11-12 11:06:35","Bière ambrée de style Vienna Lager
- Céréales : Pils , Vienna, Munich, Caramel Malts
- Houblons : Herkules
- Levures : S189
Faisant partie de la gamme disponible à l’année, elle rejoint ses soeurs dans sa simplicité à se déguster. De style ""Vienna Lager"" et brassée dans la plus pure tradition de la fermentation basse, on la distingue par sa couleur ambrée et limpide, et ses arômes de malt, biscuit et caramel qui sont à l'honneur. Le houblonnage et l'amertume sont modérés, mais laisse toutefois découvrir de belles notes de fleurs blanches.","","1","49.206351","6.900877","4 Rue Jules Verne, 57600 Forbach, France","22.2","6","10","","alexandre.wirig@brasserie-galibot.com","Ambrée 6x33cl","https://www.adopteunbrasseur.fr/listing/1tzw514lwmj-brasserie-galibot-ambree-ambree-6x33cl","Carton de 6","Grand Est","Galibot","Cuivrée","5.5","Faible","Permanente","Bouteille en verre","33cl","","","L'Ambrée de chez Galibot est bien évidemment une bière de fermentation basse mais surtout de style Vienna-Lager. Comme toute bière de style germanique, on est en présente d'une bière précise aux parfums de malts légèrement caramélisés et une petite pointe florale qu'il faut aller chercher un peu en fin de bouche. C'est très bien exécuté, sans chichis et qui invite à y revenir.","","","","","","","",""
"85985","India Pale Ale","Forbach","FR","https://cdn.kreezalid.com/kreezalid/550911/catalog/8080/99/36_kzjgi_1457640961.png","EUR","2020-11-12 10:51:44","Bière blonde de type India Pale Ale
- Céréales : Pils, Pale Ale, Caramel Munich
- Houblons : Chinook, Cascade, Mosaic
- Levures : US-05
Notre India Pale Ale est inspirée par les bières du nouveau monde, sa robe est jaune, son nez évoque les fruits exotiques et les agrumes. En bouche l'amertume s'impose accompagnée par de belles notes citriques et une finale résineuse. Elle vient compléter cette gamme annuelle que nous proposons. Elle a décroché une Médaille d’Or au Frankfurt International Trophy 2020.","","1","49.206351","6.900877","4 Rue Jules Verne, 57600 Forbach, France","22.2","6","10","","alexandre.wirig@brasserie-galibot.com","IPA 6x33cl - Brasserie Galibot","https://www.adopteunbrasseur.fr/listing/a8kuwxs8tlt-ipa-6x33cl-brasserie-galibot","Carton de 6","Grand Est","Galibot","Rousse","6","Modérée","Permanente","Bouteille en verre","33cl","","","Sans vous le cacher, on est des fans d'IPA. Alors quand on a reçu celle de Galibot, on avait de grosses attentes vu le niveau de l'équipe Galibot. Eh ben, ça n'a pas loupé: une robe blonde plutôt claire avec cette belle mousse onctueuse qui dégage des notes d'agrumes et de fleurs. En bouche, c'est rond, bien rond et c'est surtout fruité avec une amertume très plaisante qui rend l'exercice très réussi. De toutes façons, chez Galibot, on est rarement déçus.","","","","","","","",""
"85983","Pale Lagers - Helles","Forbach","FR","https://cdn.kreezalid.com/kreezalid/550911/catalog/8080/99/30_930gg_1344745486.png","EUR","2020-11-12 10:51:16","Bière blonde de type Pale Lagers Helles 
- Malts : Pilsen , Caramel Munich
- Houblons : Saphir , Herkules
- Levuees : WYeast 2208
Notre Blonde est une bière de type “Helles”, brassée dans la pure tradition de la fermentation basse. Une couleur jaune éclatante, des arômes de grain et de malt prédominant. En bouche, la faible amertume laisse un produit doux avec un joli final sur le miel.
La Helles (en allemand “clair”) est un type de bière blonde allemande de fermentation basse brassée en Bavière. Elle titre entre 4,5 et 6% d’alcool. Son goût est proche de celui des bières de type Pils mais moins houblonné et plus malté.","","1","49.206351","6.900877","4 Rue Jules Verne, 57600 Forbach, France","22.2","6","10","","alexandre.wirig@brasserie-galibot.com","Blonde 6x33cl","https://www.adopteunbrasseur.fr/listing/a930kukerl4-brasserie-galibot-blonde-blonde-6x33cl","Carton de 6","Grand Est","Galibot","Blonde","6","Faible","Permanente","Bouteille en verre","33cl","","","L'équipe Galibot est passée maître dans la construction de bières de style Lager (fermentation basse). Cette blonde ne déroge pas à la règle: une robe blonde brillante, un nez aux arômes de malt, une faible amertume et une finale avec une touche de miel. C'est rond et désaltérant, idéal à l'apéritif.","","","","","","","",""
"85977","India Pale Lager","Forbach","FR","https://cdn.kreezalid.com/kreezalid/550911/catalog/8080/108/55_z687e_968894767.png","EUR","2020-11-12 10:24:25","Bière blonde de type India Pale Lager 
- Céréales : Malt Munich II
- Houblons : East Kent Golding - Chinook
- Levure: Safale US-05
Ce produit un peu spécial est une bière inspirée d’une boisson péruvienne : la Chicha Morada. Elle est brassée à partir de maïs violet. Sa robe est d’une belle couleur rubis et sa mousse dense et persistante. La bouche est agréable, souple et légèrement épicée. Vous finirez sur des notes de litchi et d’agrumes. L’illustration de l’étiquette a été réalisée par Kevin Hohler.","","1","49.206351","6.900877","4 Rue Jules Verne, 57600 Forbach, France","22.2","6","10","","alexandre.wirig@brasserie-galibot.com","Princesse Inca 6x33cl","https://www.adopteunbrasseur.fr/listing/964iwa9xffc-brasserie-galibot-princesse-inca-blonde-6x33cl","Carton de 6","Grand Est","Galibot","Cuivrée","5.1","Modérée","Permanente","Bouteille en verre","33cl","","","Alors là, on est sur une extraterrestre....La Princesse Inca est une ovni dans le monde brassicole: une robe rubis, brillante avec une mousse fine persistante, au nez c'est le voyage assuré dans un pays tropical avec des notes puissantes de litchi. En bouche, c'est le feu d'artifice: une rondeur très agréable, une pétillance fine, un équilibre céréales et fruits remarquable. On est sous le charme et c'est une de nos résidentes permanente dans notre cave !

3* Guide Hachette 2021 et coup de coeur de la rédactrice, on en attendait pas moins.","","","","","","Coup de coeur","",""
"85854","Pilsner","Forbach","FR","https://cdn.kreezalid.com/kreezalid/550911/catalog/8080/108/58_f16nx_2104463876.png","EUR","2020-11-11 16:35:14","Bière Blonde de basse fermentation de style Pils
- Céréales :Pils, Caramel Hell, Caramel pils
- Houblon : Herkules, Saphir, Tradition, Mittelfruh
Pour cette bière, nous sommes allé chercher l’inspiration en Forêt Noire. 
Cette Pils est conçue avec une eau douce révélant l’arôme floral des houblons.
Sa robe est dorée et brillante, et sa mousse persistante. L’amerture reste subtile et laisse sa place à un final toasté. L’étiquette a été réalisée par Stéphane Perger.","","1","49.206351","6.900877","4 Rue Jules Verne, 57600 Forbach, France","22.2","6","10","","alexandre.wirig@brasserie-galibot.com","La Pils de Schoeneck 6x33cl","https://www.adopteunbrasseur.fr/listing/1ui1g9ybprq-la-pils-de-schoeneck-6x33cl","Carton de 6","Grand Est","Galibot","Blonde","5","Modérée","Permanente","Bouteille en verre","33cl","","","Il faut être clair, le style Pils n'a jamais été notre tasse de thé. Mais là, on doit avouer que l'équipe Galibot fait très fort au point de revoir notre point de vue: une robe magnifique, un nez floral et malté, confirmée en bouche avec une sensation toastée en fin de bouche. C'est sec et très désaltérant, idéal en plein coeur de l'été. 

Elisabeth Pierre au travers du guide hachette des bières 2021 lui attribue la meilleure note possible (3*) et son coup de coeur, c'est dire!","","","","","","***","",""
"85794","Witbier","Saint-Georges-de-Didonne","FR","https://cdn.kreezalid.com/kreezalid/550911/catalog/8080/99/94_ztnh1_731311606.png","EUR","2020-11-11 14:08:05","Bière Blanche à la crème de pineau.
Subtil mariage avec la bière de pineau, voilà un bière douce au palais qui rappelle la texture charnue du melon.","","1","45.607137","-0.973047","6 Rue Ampère, 17110 Saint-Georges-de-Didonne, France","38","12","10","","pauline@brasseriegeorgette.com","Par Les Soirs Bleus d'été 12x33cl","https://www.adopteunbrasseur.fr/listing/04g2dzlqpgz-brasserie-georgette-par-les-soirs-bleu-dete-blanche-12x33cl","Carton de 12","Nouvelle-Aquitaine","Georgette","Blanche","4.5","Modérée","Ephémère","Canette","33cl","","","","","","","","Bio","","",""
"85792","Fruitées / Epicées","Saint-Georges-de-Didonne","FR","https://cdn.kreezalid.com/kreezalid/550911/catalog/8080/99/93_duhte_1759278734.png","EUR","2020-11-11 14:08:28","Bière d'hiver généreuse et épicée qui réconforte par temps froid.
- Malts: 
- Houblons: ","","1","45.607137","-0.973047","6 Rue Ampère, 17110 Saint-Georges-de-Didonne, France","38","12","10","","pauline@brasseriegeorgette.com","La Saison Des Brumes 12x33cl","https://www.adopteunbrasseur.fr/listing/evgm36sx61o-brasserie-georgette-la-saison-des-brumes-blonde-12x33cl","Carton de 12","Nouvelle-Aquitaine","Georgette","Blonde","6","Modérée","Ephémère","Canette","33cl","","","","","","","","Bio","","",""
"85788","India Pale Ale","Saint-Georges-de-Didonne","FR","https://cdn.kreezalid.com/kreezalid/550911/catalog/8080/99/91_ol9eg_147001449.png","EUR","2020-11-11 13:48:58","Un tourbillon de houblon, des saveurs d'agrumes, de fruits de la passion qui feront virevolter vos papilles !

- Malts: Pilsen Bio
- Houblons: Simcoe bio & Cascade Français","","1","45.607137","-0.973047","6 Rue Ampère, 17110 Saint-Georges-de-Didonne, France","38","12","10","","pauline@brasseriegeorgette.com","Looping 12x33cl","https://www.adopteunbrasseur.fr/listing/2lajt6vlelo-brasserie-georgette-lopping-blonde-12x33cl","Carton de 12","Nouvelle-Aquitaine","Georgette","Blonde","6","Modérée","Permanente","Canette","33cl","","","La Looping est une bière de style IPA (India Pale Ale) qui ravira les fans de saveurs fruitées et florales grâce à l'association des houblons Simcoe et Cascade. Sa robe blonde et légèrement trouble, son nez parfumé et son amertume bien maîtrisée permettra aux plus sceptiques de ce style de changer d'avis (ou pas)!","","","","","","","",""
"85785","Fruitées / Epicées","Saint-Georges-de-Didonne","FR","https://cdn.kreezalid.com/kreezalid/550911/catalog/8080/99/84_6c36g_1090621120.png","EUR","2020-11-11 13:49:28","Bière au gingembre

Brumes lointaines et soleil levant, effluves fraîches et poivrées des céréales enlaçant le gingembre, c'est toujours la Saison des amours quand je vogue avec toi. 

- Malts: Pilsen bio, Froment bio
- Houblons: Simcoe","","1","45.607137","-0.973047","6 Rue Ampère, 17110 Saint-Georges-de-Didonne, France","38","12","10","","pauline@brasseriegeorgette.com","Le Vent Se Lève 12x33cl","https://www.adopteunbrasseur.fr/listing/kxk0saf5gda-brasserie-georgette-le-vent-se-leve-blonde-12x33cl","Carton de 12","Nouvelle-Aquitaine","Georgette","Blonde","5.5","Faible","Permanente","Canette","33cl","","","Elle est fraîche, désaltérante et te transporte vers des pays lointains très à l'Est. Cette bière au Gingembre est un voyage plein d'épices, avec sa robe blonde légèrement trouble et au nez floral et fruité. En bouche, la pétillance est légère, le gingembre doux et persistant en bouche comme une invitation à rester. Cette bière ravira les amoureux/ses de bières légères mais gouteuses.","","","","","Bio","","",""
