"id","category","city","country","cover","currency","date_online","description","external_id","is_online","lat","lng","location","price","price_unit","quantity","quantity_selector","supplier_email","title","url","_Conditionnement","_Région","_Brasserie","_Couleur de la bière","_Alcool %","_Amertume","_Gamme","_Contenant","_Volume","_Bière #1 du Pack","_Bière #2 du Pack","_L'avis d'Adopte Un Brasseur","_Bière #3 du Pack","_Bière #4 du Pack","_Bière #5 du Pack","_Bière #6 du Pack","_Caractéristiques","_Note Guide Hachette 2021","_Durée de l'abonnement","_Date de livraison"
"97597","Coffee Porter","Seignosse","FR","https://cdn.kreezalid.com/kreezalid/550911/catalog/8080/108/35_ndv36_1313332621.png","EUR","","La Cargo de chez Rosny Beer n’est pas une brune comme les autres. De type « Coffee Porter », nous avons élaboré cette bière avec un objectif simple mais ambitieux, magnifier la bière brune ! Élaborée à partir de 6 malts différents, elle prend son temps pour arriver à maturité, mais le jeu en vaut la chandelle. Histoire d’être surs d’avoir la meilleure qualité possible, nous avons fait un partenariat avec nos amis de chez Sunday Coffee à Hossegor qui nous fournissent du bon café fraichement moulu. A ses saveurs de café viennent s’ajouter des arômes d’épices qui invitent au voyage et à la dégustation.","","0","43.680994","-1.359804","705 Avenue de Larrigan, 40510 Seignosse, France","41.44","12","10","","thomas@rosny-beer.com","Cargo","https://www.adopteunbrasseur.fr/listing/jutj4d0cv2p-cargo","Carton de 12","","","","","","","","","","","","","","","","","","",""
"97596","India Pale Ale","Seignosse","FR","https://cdn.kreezalid.com/kreezalid/550911/catalog/8080/108/34_5vya1_1517440519.png","EUR","","La Guilty est la dernière née de chez Rosny Beer. De type Indian Pale Ale, elle est de loin la bière la plus houblonnée de notre gamme. Savant mélange de différents houblons américains, elle offre une belle amertume en bouche ainsi que des notes florales très prononcées sur la longueur.","","0","43.680994","-1.359804","705 Avenue de Larrigan, 40510 Seignosse, France","46.2","12","10","","thomas@rosny-beer.com","Guilty","https://www.adopteunbrasseur.fr/listing/yoltwe7lsdv-guilty","Carton de 12","Nouvelle-Aquitaine","Rosny Beer","Blonde","6","Forte","Permanente","Bouteille en verre","33cl","","","","","","","","","","",""
"97595","American Pale Ale","Seignosse","FR","https://cdn.kreezalid.com/kreezalid/550911/catalog/8080/108/31_qgtwo_648952694.png","EUR","","La Nanu Nanu est une bière blonde de type « American Pale Ale ». Fière de son amertume, elle se différencie de la blonde classique par l’utilisation d’une grande quantité de houblons (français et américains) et d’une levure américaine réputée. Sa bouche prononcée est complétée par des parfums de fleurs, voire de fruits, obtenus grâce à la technique du Dry Hopping, qui consiste à ajouter des houblons pendant la maturation.","","0","43.680994","-1.359804","705 Avenue de Larrigan, 40510 Seignosse, France","41.44","12","10","","thomas@rosny-beer.com","Nanu Nanu","https://www.adopteunbrasseur.fr/listing/eijb9ggfqwf-nanu-nanu","Carton de 12","Nouvelle-Aquitaine","Rosny Beer","Blonde","5.5","Forte","Permanente","Bouteille en verre","33cl","","","","","","","","","","",""
"97594","Witbier","Seignosse","FR","https://cdn.kreezalid.com/kreezalid/550911/catalog/8080/108/32_lk8ae_743347363.png","EUR","","The Helter est la bière de soif par excellence. Nous l’avons voulue légère en alcool (elle titre à 4,5%) mais néanmoins gouteuse et rafraichissante. Le défi sur cette recette à été de réussir à donner des saveurs d’agrumes typiques des bières blanches de façon entièrement naturelle, c’est à dire sans épices ou arômes ajoutés. C’est chose faite grâce au savoir faire de notre cher Arnoramix, qui par un subtil travail des houblons à su donner son caractère à cette nouvelle Rosny Beer.","","0","43.680994","-1.359804","705 Avenue de Larrigan, 40510 Seignosse, France","37.84","12","10","","thomas@rosny-beer.com","The Helter","https://www.adopteunbrasseur.fr/listing/h62dng6v91m-the-helter","Carton de 12","Nouvelle-Aquitaine","Rosny Beer","Blanche","4.5","Modérée","Permanente","Bouteille en verre","33cl","","","","","","","","","","",""
"97593","Pale Ale","Seignosse","FR","https://cdn.kreezalid.com/kreezalid/550911/catalog/8080/108/33_5q63w_1837474406.png","EUR","","La Fancy Fuzz est une bière de type « Blonde » dont l’originalité tient de l’utilisation du houblon américain Cascade en majorité. Un nez léger, résolument porté sur l’agrume. En bouche elle est relativement sèche avec une fine amertume qui la distingue des bières blondes classiques. C’est une bière rafraîchissante, idéale pour accompagner une belle journée ensoleillée.","","0","43.680994","-1.359804","705 Avenue de Larrigan, 40510 Seignosse, France","39","12","10","","thomas@rosny-beer.com","Fancy Fuzz","https://www.adopteunbrasseur.fr/listing/mjt8yzugbm4-fancy-fuzz","Carton de 12","","","","","","","","","","","","","","","","","","",""
"97592","Amber Ale","Seignosse","FR","https://cdn.kreezalid.com/kreezalid/550911/catalog/8080/108/36_3bwnc_1202453423.png","EUR","","Avec la Burning Monk, nous avons décidé de revisiter les bières ambrées classiques, dénommées également « Amber Ale ». La couleur de la bière tend vers le roux avec des notes cuivrées. Au nez vous pourrez ressentir des effluves légères d'épices et de zeste d'agrume. Enfin en bouche, sa rondeur, sa mousse épaisse et son parfum de céréales marqué vont feront redécouvrir ce style de bières tant apprécié de nos voisins de la Mer du Nord.","","0","43.680994","-1.359804","705 Avenue de Larrigan, 40510 Seignosse, France","44.44","12","10","","thomas@rosny-beer.com","Burning Monk","https://www.adopteunbrasseur.fr/listing/rxj4b7olisy-burning-monk","Carton de 6","Nouvelle-Aquitaine","Rosny Beer","Ambrée","6","Faible","Permanente","Bouteille en verre","33cl","","","","","","","","","","",""
"97591","Coffee Porter","Seignosse","FR","https://cdn.kreezalid.com/kreezalid/550911/catalog/8080/108/35_ndv36_1313332621.png","EUR","","La Cargo de chez Rosny Beer n’est pas une brune comme les autres. De type « Coffee Porter », nous avons élaboré cette bière avec un objectif simple mais ambitieux, magnifier la bière brune ! Élaborée à partir de 6 malts différents, elle prend son temps pour arriver à maturité, mais le jeu en vaut la chandelle. Histoire d’être surs d’avoir la meilleure qualité possible, nous avons fait un partenariat avec nos amis de chez Sunday Coffee à Hossegor qui nous fournissent du bon café fraichement moulu. A ses saveurs de café viennent s’ajouter des arômes d’épices qui invitent au voyage et à la dégustation.","","0","43.680994","-1.359804","705 Avenue de Larrigan, 40510 Seignosse, France","22.22","6","10","","thomas@rosny-beer.com","Cargo","https://www.adopteunbrasseur.fr/listing/ek8u2eifeli-cargo","Carton de 6","","","","","","","","","","","","","","","","","","",""
"97590","India Pale Ale","Seignosse","FR","https://cdn.kreezalid.com/kreezalid/550911/catalog/8080/108/34_5vya1_1517440519.png","EUR","","La Guilty est la dernière née de chez Rosny Beer. De type Indian Pale Ale, elle est de loin la bière la plus houblonnée de notre gamme. Savant mélange de différents houblons américains, elle offre une belle amertume en bouche ainsi que des notes florales très prononcées sur la longueur.","","0","43.680994","-1.359804","705 Avenue de Larrigan, 40510 Seignosse, France","24.6","6","10","","thomas@rosny-beer.com","Guilty","https://www.adopteunbrasseur.fr/listing/nuem94xwxfd-guilty","Carton de 6","Nouvelle-Aquitaine","Rosny Beer","Blonde","6","Forte","Permanente","Bouteille en verre","33cl","","","","","","","","","","",""
"97589","American Pale Ale","Seignosse","FR","https://cdn.kreezalid.com/kreezalid/550911/catalog/8080/108/31_qgtwo_648952694.png","EUR","","La Nanu Nanu est une bière blonde de type « American Pale Ale ». Fière de son amertume, elle se différencie de la blonde classique par l’utilisation d’une grande quantité de houblons (français et américains) et d’une levure américaine réputée. Sa bouche prononcée est complétée par des parfums de fleurs, voire de fruits, obtenus grâce à la technique du Dry Hopping, qui consiste à ajouter des houblons pendant la maturation.","","0","43.680994","-1.359804","705 Avenue de Larrigan, 40510 Seignosse, France","22.22","6","10","","thomas@rosny-beer.com","Nanu Nanu","https://www.adopteunbrasseur.fr/listing/nmdgw6nrqkdu-nanu-nanu","Carton de 6","Nouvelle-Aquitaine","Rosny Beer","Blonde","5.5","Forte","Permanente","Bouteille en verre","33cl","","","","","","","","","","",""
"97587","Witbier","Seignosse","FR","https://cdn.kreezalid.com/kreezalid/550911/catalog/8080/108/32_lk8ae_743347363.png","EUR","","The Helter est la bière de soif par excellence. Nous l’avons voulue légère en alcool (elle titre à 4,5%) mais néanmoins gouteuse et rafraichissante. Le défi sur cette recette à été de réussir à donner des saveurs d’agrumes typiques des bières blanches de façon entièrement naturelle, c’est à dire sans épices ou arômes ajoutés. C’est chose faite grâce au savoir faire de notre cher Arnoramix, qui par un subtil travail des houblons à su donner son caractère à cette nouvelle Rosny Beer.","","0","43.680994","-1.359804","705 Avenue de Larrigan, 40510 Seignosse, France","20.42","6","10","","thomas@rosny-beer.com","The Helter","https://www.adopteunbrasseur.fr/listing/4kn15ec90n5-the-helter","Carton de 6","Nouvelle-Aquitaine","Rosny Beer","Blanche","4.5","Modérée","Permanente","Bouteille en verre","33cl","","","","","","","","","","",""
"97585","Pale Ale","Seignosse","FR","https://cdn.kreezalid.com/kreezalid/550911/catalog/8080/108/33_5q63w_1837474406.png","EUR","","La Fancy Fuzz est une bière de type « Blonde » dont l’originalité tient de l’utilisation du houblon américain Cascade en majorité. Un nez léger, résolument porté sur l’agrume. En bouche elle est relativement sèche avec une fine amertume qui la distingue des bières blondes classiques. C’est une bière rafraîchissante, idéale pour accompagner une belle journée ensoleillée.","","0","43.680994","-1.359804","705 Avenue de Larrigan, 40510 Seignosse, France","21","6","10","","thomas@rosny-beer.com","Fancy Fuzz","https://www.adopteunbrasseur.fr/listing/djjsw0ilhq4-fancy-fuzz","Carton de 6","","","","","","","","","","","","","","","","","","",""
"97576","Amber Ale","Seignosse","FR","https://cdn.kreezalid.com/kreezalid/550911/catalog/8080/108/36_3bwnc_1202453423.png","EUR","","Avec la Burning Monk, nous avons décidé de revisiter les bières ambrées classiques, dénommées également « Amber Ale ». La couleur de la bière tend vers le roux avec des notes cuivrées. Au nez vous pourrez ressentir des effluves légères d'épices et de zeste d'agrume. Enfin en bouche, sa rondeur, sa mousse épaisse et son parfum de céréales marqué vont feront redécouvrir ce style de bières tant apprécié de nos voisins de la Mer du Nord.","","0","43.680994","-1.359804","705 Avenue de Larrigan, 40510 Seignosse, France","22.22","6","10","","thomas@rosny-beer.com","Burning Monk","https://www.adopteunbrasseur.fr/listing/ydmtk80ll3-burning-monk","Carton de 6","Nouvelle-Aquitaine","Rosny Beer","Ambrée","6","Faible","Permanente","Bouteille en verre","33cl","","","","","","","","","","",""
"96105","Coffrets bières","Paris","FR","https://cdn.kreezalid.com/kreezalid/550911/catalog/8080/108/21_0qael_1007565229.png","EUR","2020-12-12 16:33:46","Ce pack de Noël te permet de découvrir l'univers pop et funky de notre brasserie au travers de ces 2 premières références + 1 verre de dégustation + des conseils de dégustation:
- 2 x Jungle Fury (New England IPA)
- 4 x Hazy Pale Ale (Hazy Pale Ale)","","1","48.848998","2.319394","19 Rue Pierre Leroux, 75007 Paris, France","33","6","10","","contact@1989brewing.com","Coffret de bières + 1 verre - 6x33cl","https://www.adopteunbrasseur.fr/listing/ydz5v232jrq-coffret-de-bieres-1-verre-6x33cl","Carton de 6","Ile-de-France","1989 Brewing","","","","Permanente","Canette","","/vnegcpepfai-1989-brewing-jungle-fury-blonde-6x33cl","/ir7ko9elvhw3-1989-brewing-hazy-pale-blonde-6x33cl","C'est LE pack que tu dois te procurer si tu veux bénéficier d'un voyage direct sous les tropiques! C'est fruité, exotique, explosif en bouche avec un équilibre parfaitement maîtrisé entre la passion, l'ananas ou la mange et l'amertume de houblons made in USA.  Et en plus, 1 super joli verre pour apprécier encore plus leurs bières.","","","","","","","",""
"94890","Coffrets bières","Mamers","FR","https://cdn.kreezalid.com/kreezalid/550911/catalog/8080/108/pack-decouverte-mage-malte_gfxi0_278788570.png","EUR","2020-12-12 16:09:09","Découvre 6 bières artisanales Bio Mage Malte:
- 1 X Illumination 33cl 
- 1 X Orbe Feu 33cl 
- 1 X Iceberg 33cl 
- 1 X Archimage 33cl 
- 1 X Vulcain 33cl 
- 1 X Aristée 33cl ","","1","48.351282","0.378874","19 Rue de Navarre, 72600 Mamers, France","19","6","0","","mage.malte@gmail.com","Coffret bières Bio - 6x33cl","https://www.adopteunbrasseur.fr/listing/ouwxar0pbbm-coffret-bieres-bio-mage-malte-6x33cl","Carton de 6","Pays de la Loire","Mage Malte","Rousse","","Faible","Permanente","Bouteille en verre","33cl","/hooohdhm7z7-brasserie-mage-malte-vulcain-12x33cl","/ttbfkxdo0m8-brasserie-mage-malte-archimage-bio-12x33cl","","/mamzzqldogw-brasserie-mage-malte-aristee-12x33cl","/5egonh87t7y-brasserie-mage-malte-illumination-bio-12x33cl","/talyw1yf1or-brasserie-mage-malte-iceberg-bio-12x33cl","/skf9hqpggj7-brasserie-mage-malte-orbe-feu-bio-12x33cl","Bio","","",""
"94885","Coffrets bières","Forbach","FR","https://cdn.kreezalid.com/kreezalid/550911/catalog/8080/99/3_dfkwt_1013063022.png","EUR","2020-12-05 17:00:02","Nous te proposons un pack pour partir à la découverte de notre gamme permanente et d'une partie de notre gamme 'Craft':
- 1 x La Blonde : bière blonde de type “Helles”
- 2 x La Blanche : bière blanche de style ""Hefeweizen""
- 2 x L’Ambrée : bière ambrée de style ""Vienna Lager"" 
- 2 x L’IPA : bière blonde de style India Pale Ale. Elle a décroché une Médaille d’Or au Frankfurt International Trophy 2020.
- 2 x La Pils de Schoeneck : bière blonde germanique de style Pils
- 2 x Princesse Inca: bière de couleur rubis de style India Pale Lager.","","1","49.206351","6.900877","4 Rue Jules Verne, 57600 Forbach, France","36.6","12","20","","alexandre.wirig@brasserie-galibot.com","Coffret de bières - Into the wild 12x33cl","https://www.adopteunbrasseur.fr/listing/89fikp8v2p2-coffret-biere-galibot-into-the-wild-12x33cl","Carton de 12","Grand Est","Galibot","","","","Permanente","Bouteille en verre","","/sehsfn73sj5-brasserie-galibot-blanche-blanche-6x33cl","/1tzw514lwmj-brasserie-galibot-ambree-ambree-6x33cl","La Brasserie Galibot est une des plus belles pépites française. Ses bières sont précises, rondes et fortes en saveur. Alex, Tom et Charly ont su faire 'revivre' le style Lager qui avait été laissé un peu de côté ces dernières années. Elisabeth Pierre ne s'y est pas trompée, elle a attribué d'excellentes notes et critiques à leur gamme, avec un coup de coeur (partagé) pour la Princesse Inca.","/a8kuwxs8tlt-brasserie-galibot-ipa-blonde-6x33cl","/a930kukerl4-brasserie-galibot-blonde-blonde-6x33cl","/1ui1g9ybprq-la-pils-de-schoeneck-6x33cl","/964iwa9xffc-brasserie-galibot-princesse-inca-blonde-6x33cl","","","",""
"94552","Sans alcool","Mamers","FR","https://cdn.kreezalid.com/kreezalid/550911/catalog/8080/108/22_4xmgh_1194970321.png","EUR","2020-12-06 12:54:27","L’illusion d’une bière artisanale BIO sans alcool… L’association de plusieurs malts spéciaux et de houblons aux profils exotiques offre une étonnante palette de saveurs","","1","48.351282","0.378874","19 Rue de Navarre, 72600 Mamers, France","24.6","12","0","","mage.malte@gmail.com","Illusion - 12x33cl","https://www.adopteunbrasseur.fr/listing/9sizdgcq8pu-brasserie-mage-malte-illusion-12x33cl","Carton de 12","Pays de la Loire","Mage Malte","Rousse","0","Faible","Permanente","Bouteille en verre","33cl","","","","","","","","Bio","","",""
"94548","Fumées","Mamers","FR","https://cdn.kreezalid.com/kreezalid/550911/catalog/8080/108/21_vg0ta_1575738231.png","EUR","2020-12-06 13:03:43","La Vulcain est une bière légèrement ambrée. En bouche, on relève des notes de malts tourbés et du fruité. Elle est modérément amère mais tout de même houblonnée. Le côté fumé est discret mais présent. Les malts utilisés confère à cette bière un léger arôme fumé, complété par des notes d’agrumes provenant des houblons.

- Malt BIO Pilsner,Malt BIO Cara Ruby, Malt Tourbé BIO .
- Houblon: Pekko BIO,Citra BIO, Chinook BIO.
- Levure S33

Quelques accords : roquefort, fruits de mer.","","1","48.351282","0.378874","19 Rue de Navarre, 72600 Mamers, France","28.8","12","0","","mage.malte@gmail.com","Vulcain - 12x33cl","https://www.adopteunbrasseur.fr/listing/hooohdhm7z7-brasserie-mage-malte-vulcain-12x33cl","Carton de 12","Pays de la Loire","Mage Malte","Rousse","5","Modérée","Permanente","Bouteille en verre","33cl","","","","","","","","Bio","","",""
"94544","Blonde Ale","Mamers","FR","https://cdn.kreezalid.com/kreezalid/550911/catalog/8080/108/27_xhksk_826842388.png","EUR","2020-12-06 12:54:55","L'Alchimie est une potion blonde légère et douce. Idéal pour étancher une petite soif. L’Alchimie révèle des saveurs de céréales et sarrasin en fin de bouche. Amertume douce.

- Malt BIO Pilsen, Malt BIO Cara Ruby,
- Sarrasin Bio.
- Houblon: Pulawski BIO, Simcoe Bio, Citra Bio.
- Levure S33.

Quelques accords : asperges, salades, crudités, tarama, guacamole, sandwiches, moules, sushi, poulet rôti, carpaccio, charcuterie, rôti de veau, viandes blanches ou rouges grillées, fromages à pâte pressée cuite, fromages de chèvre, desserts aux fruits.","","1","48.351282","0.378874","19 Rue de Navarre, 72600 Mamers, France","26.4","12","0","","mage.malte@gmail.com","Alchimie - bio - 12x33cl","https://www.adopteunbrasseur.fr/listing/suyb5xdxlwz-brasserie-mage-malte-alchimie-bio-12x33cl","Carton de 12","Pays de la Loire","Mage Malte","Blonde","3.5","Faible","Permanente","Bouteille en verre","33cl","","","","","","","","Bio","","",""
"94541","Triple","Mamers","FR","https://cdn.kreezalid.com/kreezalid/550911/catalog/8080/108/25_25v7r_1736015409.png","EUR","2020-12-06 12:52:51","L'Archimage est une bière puissante ronde en bouche. Trois Malts Bio pour encore plus de saveurs. De la magie liquide pour une explosion d’arômes.
La triple Archimage est plus chargée en alcool . D’une couleur blond doré sa mousse blanche et crémeuse ainsi que sa rondeur en bouche en fontt une bière de caractère.

Bière récompensée par une Médaille d'or au concours général agricole de Paris 2019 et une note de 3 étoiles au guide Hachette des Bières2021.

- Malt BIO Pilsner, Malt BIO Cara Ruby, Malt BIO Vienna,
- Pulawski BIO, Golding BIO.
- Levure S 33.

Quelques accords : asperges, salades, crudités, tarama, guacamole, sandwiches, moules, sushi, poulet rôti, carpaccio, charcuterie, rôti de veau, viandes blanches ou rouges grillées, fromages à pâte pressée cuite, fromages de chèvre, desserts aux fruits.crémeux à croûte lavée, fromages à pâte molle (camembert) desserts caramélisés, pain d’épices, crème brûlée.
","","1","48.351282","0.378874","19 Rue de Navarre, 72600 Mamers, France","28.8","12","0","","mage.malte@gmail.com","Archimage - bio - 12x33cl","https://www.adopteunbrasseur.fr/listing/ttbfkxdo0m8-brasserie-mage-malte-archimage-bio-12x33cl","Carton de 12","Pays de la Loire","Mage Malte","Blonde","8","Faible","Permanente","Bouteille en verre","33cl","","","","","","","","Bio","","",""
"94515","Blonde Ale","Mamers","FR","https://cdn.kreezalid.com/kreezalid/550911/catalog/8080/108/23_t5nf1_838558609.png","EUR","2020-12-06 12:52:40","L'Aristée est une faveur divine qui va vous transporter de fleurs en fleurs. Les saveurs de miel se marient avec les arômes de fleurs et de malts. 
- Malt BIO Pilsen, Malt BIO Cara Ruby
- Houblon: Pulawski BIO, Simcoe Bio.
- Miel BIO Châtaignier France.
- Levure S33.
Quelques accords : foie gras, saucisson fumé, terrines, gibiers, viandes en sauce, agneau rôti, poissons fumés et grillés, acras, légumes provençaux cuits, fromages à pâte persillé, fromages crémeux à croûte lavée, fromages à pâte molle (camembert) desserts caramélisés, pain d’épices, crème brûlée.","","1","48.351282","0.378874","19 Rue de Navarre, 72600 Mamers, France","28.2","12","0","","mage.malte@gmail.com","Aristée - 12x33cl","https://www.adopteunbrasseur.fr/listing/mamzzqldogw-brasserie-mage-malte-aristee-12x33cl","Carton de 12","Pays de la Loire","Mage Malte","Blonde","6","Faible","Permanente","Bouteille en verre","33cl","","","","","","","","Bio","","",""
"94511","Dark IPA","Mamers","FR","https://cdn.kreezalid.com/kreezalid/550911/catalog/8080/108/17_hwkqv_750710691.png","EUR","2020-12-06 13:06:01","La Black Nebula cache une amertume et des arômes d’India Pâle Ale.  Laissez-vous surprendre!  Nez puissant avec des arômes d’agrumes. Une Black I.P.A. Ronde et puissante en bouche. D’une teinte noir ébène, une mousse épaisse, crémeuse, onctueuse et moelleuse en bouche.
- Malt BIO Pilsen, Malt BIO Cara Ruby, Malt BIO Froment, Malt BIO Chocolate,
- Malt BIO Black.
- Houblon: chinook BIO, Wakatu BIO.
- Levure S33.
Quelques accords : huîtres et coquillages, crevettes, haddock, sushis et cuisine asiatique, charcuteries fumées, viandes rouges, daubes, gibiers, foies gras, reblochon, roquefort, desserts chocolatés (moka, fondant au chocolat).","","1","48.351282","0.378874","19 Rue de Navarre, 72600 Mamers, France","28.8","12","0","","mage.malte@gmail.com","Black Nebula - 12x33cl","https://www.adopteunbrasseur.fr/listing/dqx0khpj513-brasserie-mage-malte-black-nebula-12x33cl","Carton de 12","Pays de la Loire","Mage Malte","Brune","7","Forte","Permanente","Bouteille en verre","33cl","","","","","","","","Bio","","",""
"94510","India Pale Ale","Mamers","FR","https://cdn.kreezalid.com/kreezalid/550911/catalog/8080/108/20_bq645_1014344654.png","EUR","2020-12-06 12:52:14","Gratitude est une IPA ronde en bouche et fruitée. Les houblons apportent des arômes de fruits exotiques, Mangue, Agrumes. Des notes de céréales sont également présente. Une IPA Ronde en bouche et fruitée. Les houblons apportent des arômes de fruits exotiques, Mangue, Agrumes. Des notes de céréales sont également présentes.
Bière récompensée par une note de 3 étoiles au guide Hachette des Bières 2021

- Malt BIO Pilsen, Malt BIO Cara Ruby.
- Houblon: Citra BIO. Rakau BIO.
- Levure US05.

Quelques accords : plats épicés ou pimentés le rougail saucisses, plat typique réunionnais, acras de morue, Couscous. N’oublions pas le fromage, car les IPA s’accordent très bien avec le Roquefort, lui qui est si difficile à accorder avec le vin d’habitude.","","1","48.351282","0.378874","19 Rue de Navarre, 72600 Mamers, France","31.2","12","0","","mage.malte@gmail.com","Gratitude - bio - 12x33cl","https://www.adopteunbrasseur.fr/listing/kvvdbovsigt-brasserie-mage-malte-gratitude-bio-12x33cl","Carton de 12","Pays de la Loire","Mage Malte","Blanche","6","Modérée","Permanente","Bouteille en verre","33cl","","","","","","","","Bio","***","",""
"94503","Fruitées / Epicées","Mamers","FR","https://cdn.kreezalid.com/kreezalid/550911/catalog/8080/108/18_udqgp_44207528.png","EUR","2020-12-06 12:52:26","L’Iceberg est une bière blanche gingembre qui révèle des saveurs adoucies par le malt biologique. Cette combinaison révèle une amertume équilibrée pour une bière formidablement rafraichissante.

Un aspect trouble, des couleurs blond pâle, une mousse un peu fugace, fine et blanche, caractérisée par des notes acidulées, la bière blanche met les papilles en éveil par ses arômes d’épices et d’agrumes. Un aspect trouble, des couleurs blond pâle, une mousse un peu fugace, fine et blanche, caractérisée par des notes acidulées, la bière blanche met les papilles en éveil par ses arômes d’épices et d’agrumes.

- Malt BIO Pilsen,
- Malt BIO Froment.
- Houblon: Golding BIO, Gingembre BIO.
- Levure WB06.

Quelques accords : crudités, huitres, fruits de mer, poissons grillés ou fumés, raviolis chinois, maïs grillé, chèvre frais, tarte au citron, sorbets, agrumes, desserts aux fruits.
","","1","48.351282","0.378874","19 Rue de Navarre, 72600 Mamers, France","27.6","12","0","","mage.malte@gmail.com","Iceberg - bio - 12x33cl","https://www.adopteunbrasseur.fr/listing/talyw1yf1or-brasserie-mage-malte-iceberg-bio-12x33cl","Carton de 12","Pays de la Loire","Mage Malte","Blanche","5","Faible","Permanente","Bouteille en verre","33cl","","","","","","","","Bio","","",""
